Message text,Категория,Kategory
It would be desirable that this year the Victory forest would be planted in the Kursk region. This action would be attended by all comers and volunteers. It could also be done so that residents and volunteers could come with their own tree.,16,False
"Hello! When will the authorities in Kursk put things in order with public transport? For several years, they have not been able to do anything to avoid standing at a bus stop for 40 minutes in the dark. Much has been said about the new transport network, and what is the result? At what stage is the two-tier transport network now? In the direction of Deriglazov, if you can leave after 21.00, then in a crowded minibus. Immediately a question to comply with coronavirus measures! How to follow them? But some stops are completely unrealistic to leave. SHA stop in the direction of Deriglazov - 5 stunted minibuses passed and none of them stopped, is this normal? How to get home? Moscow sent 40 new buses (from the master's shoulder) to Kursk, what routes will they be allowed to use?",8,False
"I ask you to install lighting on the street. Engels, at least on even supports, you understand that there is no lighting, our children go to the school bus in the dark, why it is difficult to install lighting through the pole, people go to the temple in the dark, and even where the bus stop is, there is no lighting",0,False
"In the area of ​​​​house number 38 on Kosukhin street, stray dogs without tags were found.",1,False
"Already wrote a complaint 142857. And I am writing again! Can your cleaning equipment clean the road normally? Not only cars drive along this road, but people also walk, because there is no other road to the houses!!! Heaps of snow lie on the edge of the road, people have nowhere to walk! Everyone thinks only about cars! Why can't you clear more! Now, along the edge of the road, there are 2 piles of snow along the road after the equipment. A mountain from the first cleaning and a mountain from the second cleaning! Soon the road from such negligent cleaning will become even narrower and people will have to walk along the road along with the driving cars!!!!",0,False
Residents of the village of 2nd Maksimovo ask for cleaning and maintenance of the dirt road from the ZVK-031 highway (connecting the Voronezh highway and the village of Solntsevo) to the village of 2nd Maksimovo and the road between the houses in the village of 2nd Maksimovo.,0,False
Closed view at the pedestrian crossing,0,False
"The road is broken all the way from the highway to the house of the village. Podlesny 1a Around the houses from 1 to 10 holes like after the bombing, we live in peacetime???? Why do we pay transport tax and excise tax on gasoline????",0,False
"Hello! I want to report the problem of stray dogs in the yard of the house on the street. Republican, 8. This morning they attacked me, thanks to the people passing by who scared her away. Every day I walk with my child and I have watched them sitting near my car more than once. After all, sterilization cannot protect against bites and from getting frightened by a child and even adults. I kindly ask you to help in solving this problem. After all, in fact, this is very serious! I repeat, the dogs are huge!",1,False
"A pack of stray dogs constantly scares both children and adults. I ask you to take measures to capture this flock. I have been dealing with this problem for a year now, but nothing has changed, only replies !!!!",1,False
Burnt sheds turned into a landfill. Maybe it's time to clear this place already?!,16,False
"Hello! Last fall, repairs were carried out between kindergarten No. 105 and school No. 51, during which the asphalt on the footpath was damaged. At the moment, this area is impassable mud. I ask you to restore the asphalt pavement, as well as the adjacent lawns. In the application, a mark on the map.",3,False
"In 2020, I wrote to your website about the lack of a road on the street. Baklashovka. D. 1 Mokva. They sent me an answer that in 2021 the road will be repaired using the `People's Budget` program. but it's already mid-June, and work hasn't started. Please clarify the situation. In 2020, I wrote to your website about the lack of a road on the street. Baklashovka. D. 1 Mokva. They sent me an answer that in 2021 the road will be repaired using the `People's Budget` program. But it's already mid-June, and work hasn't started. Please clarify the situation, will the road be repaired this year?",0,False
"I am addressing the issue of repairing the road to the house at the address: st. Mira, d. 8/5. 28.09.2021 a letter was received, in the text of which, it was promised to repair the problematic section of the road before 11/01/2021, but already on 11/08/2021. The pavement was never restored! Once again I kindly ask you to deal with our problem!",0,False
"This is how we collect garbage. There was no announcement or warning that there would be no car to pick him up. People took out the garbage on the appointed day, but the car was never there. By and toga in the morning such a picture",16,False
Pits along the entire roadway of the 3rd Krasnopolyansky Lane,0,False
"On the section from d Beregova 5 to d Beregovaya 17, an unknown company took out deadwood, filled up the entire roadbed with garbage and did not remove it (presumably the owner of the land along this roadbed from Beregovaya 5 to Beregovaya 17)",0,False
"Good afternoon. Specify whether there is a pedestrian crossing in this place (for crossing Sadovaya street along Radishcheva street)? On Yandex.maps it is indicated that there is. In practice, there is no traffic light for pedestrians, no zebra crossing, and no sign available for pedestrians to see.",0,False
I ask you to start one flight a day on the route Lgov 2 - Railway Station-Lgov 2. Departure from the Lgov 2 stop at 10:00 and departure from the Lgov 1 stop at 19:10. I ask you to put on the route of the carrier Tatarenko M. V,8,False
I would like Russian Railways to install a “smart system” for warning passengers at the Lukashevka station. I would like to see in the station building some kind of art gallery dedicated to the railway and the region as a whole.,8,False
"Sellers from the “Bird Market” (Central Market) and also buyers fulfill their natural needs right under the fence of the market The director of the “Central Market” was offered to install dry closets, but there is no result In the summer there is such a stench that it is impossible to pass",16,False
"At the pedestrian crossing near the intersection of 50 Let Oktyabrya and Dzerzhinsky Streets, since April 2021, the indication of the green signal of the pedestrian traffic light focused on pedestrians crossing the carriageway of 50 Let Oktyabrya Street and located near house No. 2-B along 50 Let Oktyabrya Street has not been working. In response to message No. 88040, it was reported that its work was restored until the end of May, however, as of July 17, 2021, the pedestrian traffic light is still not working. I ask you to bring the work of the pedestrian traffic light to the normative state.",0,False
"A lot of signs were installed on Kryukov Street, stopping is prohibited without creating additional parking spaces.",0,False
"From Lomakin street, to the E38 highway. Snow is not cleared, not sprinkled with reagent. It is slippery and difficult to go up the slope, and not safe to go down.",0,False
"In 2021, in connection with road works, a road sign 'Stopping and parking is prohibited' was installed at the intersection of Dzerzhinsky and Ovechkin streets. Upon completion of the work, the sign remains in place. Dzerzhinsky Street is one of the central streets of the city of Kursk, but due to the lack of parking spaces in this area, certain inconveniences are created due to the installed road sign. Cars parked on this section of the road did not create any inconvenience, because. the width of the carriageway is quite enough for parking. Please look into the current situation and remove the sign `Stopping and parking is prohibited` from the intersection of Dzerzhinsky and Ovechkin streets.",0,False
"--Good afternoon. I ask you to explain such inhumanly long terms in the design of a disability group. On December 15, 2021, all documents were handed over to the Kurchka Polyclinic No. Korotkova, oncologist for registration of a disability group (Sekachev Igor Mikhailovich, born 10.10.1962) - stomach cancer. So far, no results. They called on the vtech - they said there were no documents, the oncologist said wait. Just what to expect. The father does not work, it is difficult for him to walk and move around, he is not a pensioner, how can he live and wait until they establish a group and start paying a pension? Please pay attention to this situation. Sekachev Igor Mikhailovich G. Kursk, st. Domostroiteley, 10, apt. 1. +79307620921",4,False
"Landfill, trash and trees",16,False
"Good afternoon, there is no road surface in our village, and it is not clear when the asphalt will be laid. Could you bring the old removed asphalt from other streets to our village Avitor-2. Thanks in advance!",0,False
"A month and a half ago, a factory sewer broke through on Koltsevaya Street. Workers arrived, dug up and all this is still standing in this form. There is an unbearable stench throughout the street. Every day, children go to school and walk past this pit. Please take action to fix this issue.",16,True
"The roadbed has been torn open for more than 6 months, why is it not put in order?",0,False
"The entrance to the antenatal clinic N6 has not been cleared, the depth of the ice rut is more than 10cm. Also, the sidewalk is in a deplorable, uncleaned state. A person with sore legs is one torment to go.",0,False
"Hello. Previously, they filed a complaint about the lack of an essential drug called infliximab for my husband. The answer came that this drug is not available on the territory of the Russian Federation. How is this possible if in the Internet source the manufacturer is CJSC Biocad - a Russian company?! Please explain who is the manufacturer of the drug infliximab ?? Replacement of the drug is not possible due to inefficiency.",4,False
"Bus routes 267,254,267 `a` are very rare. Summer residents have to wait from 40 minutes to an hour. And there is nothing more to get from `Abkhazia`. These buses cannot be tracked by mobile, as other routes do. One of the drivers of this bus said that the owner demands daily earnings, and then free time for drivers. So the passengers are standing, waiting, but there are no minibuses. We do not know where to call about this disgrace, so we wrote to you. Help us!`",8,False
"In the second entrance of house No. 3 on Herzen Street, for several weeks now, there has been an unbearable smell of sewerage.",16,False
"Good afternoon! Along the linden alley (understudy of Soyuznaya street on the site: the fitness center “Ocean Trio - Park - Temple”) a pedestrian zone was previously installed with signs “Pedestrian zone” at the beginning and at the end of the section), but the sign at the beginning of the section disappeared (screenshot of the photo where it is was attached). At the same time, the alley is very popular with children and adults for cycling, scootering and rollerblading. Now the pedestrian zone has turned into a road with quite heavy traffic, which will inevitably lead to accidents with victims. I ask you to restore the “Pedestrian Zone” sign and strengthen control by the traffic police over compliance with traffic rules, one traffic police crew during the evening will be enough to restore a popular recreation area among the residents of the district. Thank you.",0,False
"Road surface and lawn not restored after repair work. Kvadra worked in winter. Entrance to the house Khutorskaya 4, from the side of Khutorskaya 10, next to the garbage containers",3,False
"I can’t drive to my house, a strong wind covered the road with snow.",0,False
"I report an unpleasant smell from the Mushroom Rainbow. The stench appeared on 03/06/21 late in the evening and continues until the moment the message is sent, the window in the house cannot be opened",16,False
"Last autumn, new lights were installed on old poles, but the line to electricity was never connected. The road belongs to the city. We just laid and connected new lighting poles along Tchaikovsky Street - we hoped that these poles would also be connected. I ask you to take measures to connect city lighting!",0,True
"Central hospital, pavement, grass in paving slabs, unfinished paths, unfinished roads inside the hospital, potholes, dirt instead of roads in the hospital, the same thing for years",0,False
I ask you to install lighting in the village. Karl Liebknecht on the street. Freedom.,0,False
"Good afternoon. I ask you to explain to me the procedure for registering disability for my mother Anna Mikhailovna Tokareva, born on 02/07/1942. In 2015, she had a stroke, after which dementia began to appear, the diagnosis was made in 2018 by neurologist Kharchenko S.N. at Family Clinic LLC, because of the pandemic, they turned to the Kursk Clinical Psychoneurological Dispensary, and on 11/11/2021, doctor Shikareva Anna Alekseevna confirmed the diagnosis with a certificate: vascular dementia. The registration of the group began at the mother's place of residence, in polyclinic No. 6, but the documents were returned to us without explaining the reason. They sent this question to the Kursk Clinical Psychoneurological Dispensary with this question. N.A. Semashko” from 01.10. to 12.10., after which her condition changed for the worse. Please help.",4,False
"Good afternoon! Earlier, I sent you an appeal on the following problem: The pedestrian crossing after 50 years of October in the Pyaterochka area (Abkhazia cafe) is not illuminated. In the evening, complete darkness. There is a lamp, but it does not light up. I think you need to replace a burnt out bulb. My message was assigned the number 77132. I was sure that my appeal was being finalized, since the problem had not been resolved, and on 04/05/2021 I was informed by e-mail that the message No. 77132 had been sent for revision and would be considered in accordance with the Regulations processing and publishing information on the portal. Imagine my astonishment when I saw that the problem was closed as solved, without confirmation by the applicant and the attachment of supporting photographic materials. The problem is still not solved, the closure of the problem is not justified. Please get back to solving the problem!",0,False
"Good afternoon! I ask you to consider the issue of transferring students and schoolchildren to remote learning. My daughter goes to a technical school and says that half of her group is sick, but at the same time they go so as not to miss the curriculum, what kind of mockery is this. I believe that children should at least spend this school year on distance learning.",7,False
"Why are they not included in modern electric transport, which is equipped with air conditioners?! Until you get to the center from Deriglazov, you will bake in an electric bus!",16,False
"Hello! In 2020, I completed the construction of a residential building at the address: Kursk region, village of Tatarenkova, st. Admirala Ushakova, 8. There is no normal road to my house, ordinary cars pass with difficulty. It is difficult to walk on foot - it is very dirty. Given that our street is poorly built up, I ask you, as a temporary measure to provide transport infrastructure, to grade the unpaved part of Admiral Ushakov Street in the village of Tatarenkov (cadastral number 46:11:111802:320) and carry out dumping of used material (crushed concrete, broken brick, crushed stone, etc.).",0,False
Parking on the sidewalk,0,False
"I ask you to install a new, modern stop complex at the 3rd Pushkarnaya street stop. We need to replace the fence and install new road signs, as well as make a boarding platform with a ramp.",0,False
"Hello, on June 22, I received a notification from public services that a decision had been made to provide a monthly allowance from 3 to 7 years, but no payments were received.",10,False
Damaged road sign,0,False
"Good afternoon. I can not get a solution to the issue on message 91468 dated 05/20/2021. Many months of correspondence did not lead to any results or mutually beneficial solutions, specific answers to questions were not received. I ask you to help in solving the problem.",0,False
The exit from the parking lot to Kulakov is broken,0,False
"I would like you not to draw with the lives of our children and transfer students and schoolchildren to study using distance education. As practice has shown, distance education is effective and I believe that our children should now not study at technical schools, but study at home and how to have less contact with their peers. If you cannot transfer everyone to distance learning, then transfer those who are not vaccinated, I have a son, he is not vaccinated, because he is a minor, why should he risk his health and go to receive knowledge when they can also be received at home. Please consider my request as it should be.",7,False
"Good afternoon, the steps of the stairs leading to the bridge over the Tuskar River are broken. Thanks in advance)",0,False
"Good afternoon, the administrator of the community https://vk.com/public74294180 blocks members without explanation.",2,False
Please provide information on the procedure for visiting the skate park on Ermoshkino Lake. On the railing hangs an announcement posted by someone unknown with a limiting age. Who established and hung these rules. Children close the door and let each other in only on the principle of acquaintance.,3,False
The view at the pedestrian crossing is closed by bushes.,0,False
"As a matter of fact, the problem is that there is no piece of paved road from 1st Stepnaya Street, on the left side to Hippodrome Street to house 35, about 30 meters, then there is asphalt. At one time, when people built houses along this street, the residents of the street paid for the road along the street, but the first 4 sections were the owners, elderly people without cars and did not invest. Where or how is it actually possible to solve the problem? There are photos of the section without asphalt. Thanks in advance!",0,False
"For the third month, we are trying to provide Topamax and Lamotrigine with no medicines. And they say that medicines are in abundance. Bekasova Olga Aleksandrovna that according to the feeder, that the regional budget has zero results.",4,False
"Good afternoon! Please pay attention to the lawn along the street. 3rd Peskovskaya. At the beginning of the street, where poplars grow, under these same poplars there are many fallen branches, car tires. Please arrange for all this garbage to be removed. Special thanks to the students of secondary school No. 3, who took part in the subbotnik (well done!), They did a good job in this area, but it is difficult for children to cope with such garbage, here it is necessary to adjust the car for the removal of “large” garbage with subsequent disposal.",16,False
"A dump of various kinds of waste is produced, the territory is polluted there.",16,False
"I ask you to restore lighting on the street. Sports (road to the local depot). The fact is that there is no lighting, and children go to school along this road. The only lighting is the railway crossing.",0,False
No hard pavement,0,False
"I ask you to remove the city enterprise for the transportation of passengers and private traders. They violate our rights. Will the region really not help you so that we have our own transport company in the city? You generally monitor social networks, you look at our carriers, they do what they want, and we, ordinary residents of our city, are suffering. I ask you to do something and do not write replies, these are already serious problems, all normal cities have already got rid of private traders, large-capacity buses go everywhere but not GAZelles, but we will soon have one minibus for the whole city.",8,False
"On September 25, I fell ill with a coronovirus, which was confirmed by a positive PCR test dated September 25, 21. On the same day, a sick leave was opened in a medical organization at the place of residence. On October 8, he was discharged and also has a negative PCR test. Until now, there is no QR code for the sick person on the State Services portal. I am attaching scans of PCR tests and a sick leave certificate.",4,False
"I ask you to conduct a survey in the group https://vk.com/lgovofficial about public transport in the city of Lgov. Polls should consist of several types: what kind of transport would citizens like to see on the streets of the city, i.е. small-class buses or large-capacity buses, it is also necessary to introduce a new public transport scheme to residents, the old one is simply outdated, the city needs to be developed, new routes should be opened, it would also be necessary to invite some transport company from Kursk to the city. I also ask you to first make a vote for the citizens, and then submit the projects. I hope for your understanding, it is necessary that the citizens of Lgov also participate in the development of our city.",8,False
"Hello! On the territory of the market at the address Kursk, Khrushchev Ave. 36a, there is a constant (for several years) violation of sanitary legislation in connection with the operation of the market. On the mark marked on the map there is a garbage dump of this market, which is almost never removed and not taken out, the stench from this garbage dump does not allow you to open the windows of a nearby apartment building once again, there are no containers and garbage cans, rats run in dozens of pieces, which have already spread and to adjacent garbage containers belonging to an apartment building. By the forces of the workers of the HOA, standing next to the house, rat-baiting is regularly carried out, but since. If the market does NOTHING with its trash, then the situation with the rats already running to the playground (according to numerous eyewitnesses of the Khrushchev house 36) and the fierce stench does not change in any way. I ask you to check this appeal, to bring the responsible persons to administrative responsibility for violating the dignity. legislation and oblige the owner of this agricultural. market to eliminate the garbage dump.",16,False
"Good afternoon! A relative lives in the area, had been ill (they didn’t take an analysis for KV, they said they take it only after CT) and now she has chest pains, etc. It is necessary to do a CT scan because flura showed that lung damage is eating, in a local clinic they are sent to Zheleznogorsk, they said they will write down the day after two they will call and say where, from Zolotukhino there are no direct trains or buses and the distance is 2 times farther than from Kursk, it’s so hard for her to breathe and even such a road. The question is, can this be done in Kursk? The health committee said that the heads. the doctor makes decisions where to send them, it’s impossible to get through to Svetlana Nikolaevna (they don’t pick up the phone at all, I’ll stay in the morning) they wanted to talk to her, it’s not at all clear why she makes such decisions to send sick people to such distances. The disease is known to progress rapidly, treatment is needed,",6,False
"To kindergarten No. 21 at the address: Kursk, st. Submariners. 15, roads are not cleaned at all! It is impossible for people to pass, cars get stuck in the snow, they have to be pushed out, two cars cannot pass. Not once during the snowfall did the road services come and clean the road! Not only do people walk in the dark in the evening, but it’s simply impossible to get to the bus stop! Please take action!",0,False
"Please help to put things in order with walking dogs in the Park of Heroes of the Civil War ""Borodino"", st. Radishchev. Here are parents with children, with prams. Elderly people are gaining strength. They go in for sports. Unfortunately, the park was turned into a dog playground. There used to be signs that walking dogs is prohibited. Then they were quietly shot down. From 7 am to 10 pm in good weather, there are dogs, without muzzles, by the eternal fire at night (pictured). In winter, urine and excrement can be seen near the trees. In summer, fungal infection on the trees. The owners are usually rude to comments, sometimes they set them on. Have there been many proposals from them for organizing a walking area? Do they know that there are graves here? Are there any cleaning supplies? The park with the Eternal Flame, monuments to the victims of the civil war, the repressed, the burial place of those who died in hospitals in the Second World War, they turned into a dog playground. It can be scary to walk there, it’s disgusting in winter, dog waste is clearly visible in the snow. It is necessary to oblige the management of the park to install signs with a ban on walking. The police sometimes conduct raids, more often from 7-9 and from 19-21 hours - toilet time, to fine. It will quickly come to what is impossible and what is possible. We ask, we demand to protect the Borodino park, thereby preserving it for many years!",1,False
"Good afternoon! A very big problem with garbage. It is not cleaned at all, very dirty",16,False
"Hello! Every day my family gets to work by road (Kursk region, Kursk district, 1st Moscow, from the intersection of Kozhevennaya street with 1st Central lane to 10 B along Kozhevennaya street) which does not stand up to criticism: pits, violation of the asphalt surface, after rain, puddles form that cannot be bypassed or bypassed. And on the site from house 4 to house 10 B along Kozhevennaya street there is no asphalt pavement. Please bring the pavement back to normal. Respectfully!",0,False
