Message text,Категория,Kategory
Aggressive dogs. On the rainbow there is a flock of grown puppies and adult dogs. They rushed at the Child. Soyaki rush to try to bite the legs. Talking to the guards didn't work.,1,False
"A caustic and unhealthy smell from the quarries of the Cheese Valley plant. - they clean pipes and technical baths with `caustic soda`, then this liquid is poured into the soil without filtration, from where everything enters the groundwater; - in recent years there have been two big fires in the quarries. fat is drained there, which burns well. The gas pipeline was damaged due to the fire. In the presence of wind, the village could burn down; - a pungent odor spreads up to 10 km in different directions, depending on the direction of the wind; - sewage fell into the forest in winter, and a couple of years ago into the pond of Kalinovka village; - an activist who fought against this phenomenon (Dmitry Kutepov) was intimidated by the plant's guards, and people from law enforcement agencies were threatened with a prison term; - Since 2008, the villagers have been complaining, but no action has been taken; - Children have repeatedly fallen into these careers, incl. Adults. No deaths; - headaches and asthma attacks develop from a pungent odor. * Clean water is purposefully collected in one quarry. This quarry is located near the road and all inspections take samples from it. Made it specifically for this. At the moment, waste is drained at night, but it happens during the day. Always at different times. When draining, the fatty film on the surface is broken and everything is tightened with a pungent odor. According to the norms and legislation of the Russian Federation, this production should not be located near residential buildings. Hence, there is a gross violation of the location of production and the location of its tanks for draining sewage. We hope that the laws of the Russian Federation will be observed and production will be moved to another place far from residential buildings or the pits will be drained,",16,False
"Good afternoon. At the stop `Ploshchad Rokossovskogo` the underpass is in very poor condition. It is difficult to go down into it and it is difficult to climb out of it, since its steps are broken, and in winter ice still appears on them, which makes movement several times more difficult (both going down to this underground passage and going up). There is a great opportunity to fall and get injured, even holding on to the railing, because if the steps are just icy, then there is still an opportunity to somehow hold on to them, leaning on the railing when descending or ascending, and in this case, the steps of this transition are not only covered with ice in winter , but they are also in a terrible state that is dangerous to people's health. I ask you to deal with this problem and make good steps in this underground passage. Sincerely, Polovinkin V. S.",0,False
"Hello, in the village of Stary Buzets, the roads have not been cleared of snow for 3 days. There is no way to go to work. I work in a taxi, I have to pay for a car rental, but I can’t leave for the second day. I'm standing here in the middle of the road, stuck in the snow, under which there is ice.",0,False
"Good afternoon. Please help us solve our problem! In the courtyard of the house Orlovskaya 12 and the house Orlovskaya 16, for many years there has been a pit, which is constantly filled with water. It is impossible to drive a car, let alone walk.",0,False
Road,0,False
"Good afternoon. Today, 08/17/2021, an accident involving a pedestrian occurred in front of my house. Not so long ago, the park was landscaped and the exit from this very park to the road was laid out of paving slabs. Unfortunately, the crossing from this exit was not secured by a pedestrian crossing. For many years, this section of the road has been the shortest way to get through the carriageway to the private sector of buildings and is very popular among the elderly and schoolchildren. The crossing with a traffic light, which was installed not far from this place, did not improve the situation, and people both crossed the road lower towards APZ-20 and still do it. I ask you to consider the option of installing a “Pedestrian crossing” sign and applying appropriate markings on this section in order to prevent possible accidents involving pedestrians, as well as to regulate the speed limit of vehicles that repeatedly exceed the speed limit on this section of the road at night, thereby exposing citizens to additional danger. Thank you for your assistance. Novel",0,False
"There is no road lighting from the beginning of Pobedy Avenue, including in the area of ​​the pedestrian crossing from the Meteorological Station stop from the side of Tamchishina Street along the Walk of Fame, which creates a danger of an emergency.",3,False
Please put me and my family on the waiting list for financial assistance,6,False
"We are constantly cleaning the territory between the extreme houses on Anatoly Deriglazov Avenue and SNT ""Festivalnoe"", but ""things are still there"", according to information from summer residents, the land plot on which the dump 24 by 7 was sold by the chairman of the SNT and this unauthorized landfill has owners . Who is to blame and what to do? We have an apartment on Deriglazova Street and a summer cottage in SNT ""Festivalnoe"", this situation has already bothered me, where are the tanks of SNT? Unclear! 1 or 2 tanks for such a huge SNT is a shame, but not a reason to spoil.",16,False
"Opposite op 412 km (by rail) there are sawn branches, and a lot of garbage, I would like the owner of the infrastructure to put things in order near his place, and also cut all the wild plants to the end. You understand that some of the dry branches are left there, now our crazy youth can take and replenish, and next to the house, everything will burn there. Hope for understanding.",16,True
"Under the “year of roads” program, work was carried out during which the roadway was being repaired in the area of ​​the Belgorodskaya 20 house, the sign was removed upon completion, and the pins remained in the ground, I tore the bottom of the car while parking and hung on them, please cut or remove them as soon as possible",0,False
"I ask you to make a rate for the mask mode for minibuses Kursk-Tetkino-Kursk, Kursk-Belgorod-Kursk, etc. Rest Lgovsky turn. And look that your mask mode is not observed even by the attendants (driver). During the raid, please take pictures. Taking into account the fact that I recently went and there were 8 passengers in the minibus, taking into account the driver without masks, of course, you will not get 5-6 protocols, if something managed to put on a mask when you see you, you must also draw up a protocol. I hope for understanding, and for a photo report. In general, you need to conduct continuous video recording to confirm the violation.",8,False
"Good afternoon! After adjusting the traffic lights on this section, the traffic light on the main road began to work incorrectly: when the yellow signal is lit for drivers, the green signal is lit for pedestrians, and cars and pedestrians move simultaneously. Nearby is the Palace of Pioneers, which is attended by thousands of children. Repeatedly in front of my eyes people were almost knocked down. Please take action, thank you!",0,False
"On the way from st. Karl Marx in the direction of Iskra settlement, solid pits, patching was done anyhow, the seams on the road were not spilled with bituminous mixture. Please do it well!!!",0,False
"For the next day in a row, a strong stench from the Mushroom Rainbow, it is impossible to stay on the street for a long time, the windows in the house cannot be opened. Are you going to take real action or not??? From your answers about various studies and investigations, there is no result, the stench has remained as it was.",16,False
"Good afternoon! Opposite houses No. 31 and No. 30 on the street. Romashkova of the city of Kursk, when laying asphalt, its surface (deep depression) was not planned, which after any rain is filled with water. The local authorities have not been able to resolve this issue since 2017!!!! In the meantime, everyone thinks and decides the inhabitants of the street. Romashkova, living in the city, go to work, school, shop, etc. in rubber boots. I ask you to intervene and provide assistance in solving the problem of the people of this street, since at the moment this problem is especially acute during the period of heavy torrential rains and snowmelt. Thank you in advance)))",0,False
QR code not received,4,False
I propose to check the quality of this bread and compliance with the production technology as a whole at the plant. Mouse poop found in bread,13,False
"Why, when they cleared Suvorovskaya Street of snow, they didn’t clean the pocket for the minibus? It was covered with snow when the harvester was driving and left it like that !!! The minibus now stops not at a bus stop but on the road! This interferes with both cars and is dangerous for passengers !!! The minibus is now parked 4 meters from the put pocket !!! In the photo, I indicated where the stop was and the video How far from the Karman stop is the minibus! Worth a spacious road! And passengers have to get over a pile of snow left by a snowplow!",0,False
"When will the Sergeyevsky FAP be updated? The building has cracks in the walls, leaking roof, furnace heating. Under what conditions are patients admitted? I hope that in 2022 the Sergeevskoye feldsher-obstetric station in the Lgovsky district will be replaced with a new, comfortable and modern one. The answer to the complaint is to send an explanatory note with the application of the facts about the FAP.",4,False
"On the side of the house, Karl Marx Street 66/8, there is a dump of household and construction waste.",16,False
"I ask you to install a road sign “stop” and a stop pavilion. What kind of disgrace is going on with you, there is a stop but there is no sign or pavilion. I also ask you to answer not with a reply, but with the result.",8,False
broken traffic light,0,False
"Hello. My mom lives on st. 2nd Novoselovka, earlier buses number 6 “ts.rynok-zhd vokzal” and minibuses traveled along Streletskaya on the same route, and it was possible to leave both early in the morning and late in the evening, and it was not necessary to wait for transport for a long time. Now only 2 PAZ buses run, the waiting time for transport sometimes reaches 40-50 minutes. Please help improve the transport accessibility of the area.",8,False
"Hello. On the section of the road near the building number 2d on the street. 2nd Novoselovka, Kursk, traffic lights were installed, which are currently not functioning and there is no zebra road marking, but a road sign “Pedestrian crossing” has been installed. However, motorists ignore the “Pedestrian crossing” road sign, drive at high speed and do not slow down in front of the indicated sign, creating a dangerous situation for the pedestrian. In this regard, I ask you to take the necessary measures to ensure the safe crossing of the road by a pedestrian on a section of the road near building No. 2d on the street. 2nd Novoselovka, Kursk.",0,False
"Why tram car 71-619K No. 5343 does not go on the line. So you applied for tram cars of this brand, and what happened to them, you just killed them even more. When the cars of this series will be repainted.",8,False
"I ask you to clean the road surface on the street. Vokzalnaya (road to mamlobaza). I would also like you to fill deep pits with asphalt chips or gravel. Hope you hear us. We do not ask you for a new road surface, we ask for ordinary asphalt chips or crushed stone.",0,False
"It is necessary to create a safe and convenient pedestrian crossing from Blinova Street to Yamskaya Street for citizens with children, including in prams and with scooters, bicycles. There is no convenient exit (sills, tram tracks, old asphalt with holes), passage through the tram tracks. The path is very narrow, the stroller fits neatly with the rails. Also, the stop is too far from the pedestrian crossing, you have to make a big detour. There is no stop on the opposite side, and the population is already large at the moment. There is a long distance between the Perekalsky and Kirovsky bridge stops due to the uphill climb. I ask you to create conditions for comfortable living and moving.",0,False
"The section of the highway leading from the Shchigrovskaya highway to the village of Muravlevo-Mikhailovo-Nozdrachevo is not serviced at all. During the month of February, when there was terrible ice, the road was sprinkled 1 time, on February 26, 2021. just before the thaw. I wrote to the group in contact with the head of the Kursk region A. Telegin, he told me that “According to your request, I inform you that the road you indicated does not belong to the Kursk region, it belongs to the committee of transport and highways of the Kursk region.” I talked with a representative of the committee of transport and highways, asked them not to forget about our section of the road, but no action was taken. Today is 03/01/2021. in the morning there is heavy ice on the roads, I “fly into the ditch” in a car with a 3-year-old child, after I call the committee again, I talk with Prokopov Anton Vladimirovich, who is responsible for the road of this particular section (Muravlevo-Mikhailovo-Nozdrachevo), he assures me that everything will be done, he refers to the irresponsible attitude of the Avtodor company. After that, I called the Avtodor company, talked with Alexander Grigoryevich, who was talking to someone else at the same time, showed disrespect, said: “Yes, yes, I’m listening. Complain.” Not knowing which section of the road to sprinkle, he said: ""The car has already left."" How to talk to such irresponsible people??? Who do I reach out to??? showed disrespect, said: “Yes, yes, I’m listening. Complain.” Not knowing which section of the road to sprinkle, he said: ""The car has already left."" How to talk to such irresponsible people??? Who do I reach out to??? showed disrespect, said: “Yes, yes, I’m listening. Complain.” Not knowing which section of the road to sprinkle, he said: ""The car has already left."" How to talk to such irresponsible people??? Who do I reach out to???",0,False
"Good afternoon, Near school No. 54, the kvarda was repairing the heating system, the pit was dug up, but the asphalt was never returned, kvadra August 6, 2021 on the social network VK promised to restore the canvas within a week, but to date (08/17/2021) nothing has been done.",0,False
"Hello. Signed up through public services and vaccinations. For health reasons, KoviVak is more suitable. Enrollment in 1 clinic on Sadovaya. I'm afraid that I will come, and there is only Sputnik. How to be me.",4,False
"Good afternoon, such a problem .... Leningradskaya st. 39, near the 5th entrance ... since the fall of 2020 in the parking lot for cars, there is a VAZ 2110 state number n549uu 46 silver, today 04/29/2021 .... the car is covered in dust, there is a lot of traces of birds .... the car does not move, the owner has never been and is not visible, he left notes several times to remove the car, no one reacts, the car occupies a parking space, and there are not enough places ... I ask you to find the owner, and let him clean the car from the yard, it will remove it, and not move it to several cars to the side ... ..",0,False
"Good afternoon ! Applied in May 2021 for an increased allowance from 3 to 7 years for her first child, who turned 4 in March 2021. A refusal came, although according to all my calculations it should have been approved. The reason given in the refusal is that the first reason is that it exceeds income, the second reason is that an able-bodied family member does not work, that is, I am. I now explain my position. The reason exceeds income: is a child born in April 2021 considered in the calculations, and payments from 3 to 7 years are included in the amount when calculating the living wage? If not, then we have to go through the amount of income for 4 people in the family - my husband's salary for the past year was about 300 thousand, I received unemployment payments from April to September, this is about 30 thousand rubles, and benefits from 3 to 7 years from March to January is about 55 thousand. even taking the amount to the maximum, I didn’t manage to reach 4, which exceeds the subsistence minimum, taking into account benefits from 3 to 7 years. The second reason for refusal is a non-working family member. In March, the eldest child turned 3 years old, sat with him until 3 years old, in April until September she was at the labor exchange, in September she was registered for pregnancy? Whose right? And now my husband is unemployed.",10,False
"I ask you to build a railway line from the Kursk railway station to the airport (Vostochny). It's time to develop an infostructure, or build a tram line. In normal cities, AIREXPRESSES have been going to the airport for a long time.",8,False
"Along Chernyakhovsky Street (from the Parusnaya stop) and to the intersection with Lugovaya Street (the area of ​​the Dubrava ring) there is no lighting of the roadway, in this section the light is only from Gazprom No. 416 gas station (name from the Yandex map source). in the pits and potholes, drivers try to go around, and at night this creates the prerequisites for accidents. Please take action. The traffic on this section of the roadway is very busy. Installing lighting will significantly reduce the risk of accidents.",0,False
"At house number 19 on Druzhby Avenue from the side of the passage to the street. Fetovskaya, an unauthorized parking area is being built. 2 trucks of crushed stone have already been brought to the territory. Please look into it and take action.",11,False
Drains chemistry,0,False
"Today in the afternoon and until the evening there was a stench from the Mushroom Rainbow. Also, please let me know if inspections were carried out by the control and supervisory authorities in connection with the repeated stench during this calendar year, which you have been informed about more than once. Also, if possible, please inform about the amount of penalties. Your inaction is as much of a problem as the stink from the Mushroom Rainbow. Forced to appeal to higher authorities.",16,False
"Municipal Unitary Enterprise ""Lgovskoye"" has not been paid wages for more than two months, the husband works for thanks, which he also does not receive thanks. The head burns the salary receive not earlier than April. How long can you tolerate the irresponsibility of this organization??? PS At the request of a friend I am writing!",14,False
"Near the playground of kindergarten 120, cars are regularly parked on the lawn, namely at the corner of the kindergarten, which is adjacent to school 54. Children in the garden walk on the playground 10 centimeters from someone's cars. So drivers still throw garbage and gobies. I wrote about this earlier in one of my appeals, the result was 0. Make a fence, plant a lawn, plant trees, put a high curb, do at least something. Please take action",3,False
"I study in Moscow, I was tested positive for coronavirus, after which I left by car for Kursk, where I was registered, in order to calmly go through quarantine (I indicated the address in the signed papers to the Moscow Health Department, told me by phone, they promised my papers to the local department). Yesterday was the last day of my quarantine, I wanted to call a doctor from the clinic at my place of residence, but I could not get through to the reception. I plan to leave soon if the second test is negative. What do I need to do and where to go to call a doctor at home and close the quarantine if the virus is no longer there?",4,False
"Good afternoon. Car drivers parked their cars on the ground without artificial turf, which violated Art. 28 of the Law of the Kursk region. Violation detected on the street. Olshansky at the end of house 21, 02/04/2022 around 11:14 am. This territory does not belong to the adjacent territory, the boundaries of the adjacent territory 21 houses are included in the cadastral land plot Cadastral number 46:29:103022:50 obl. Kurskaya, Kursk, st. Olshansky, house 21,23,25. In connection with the above, I ask that the drivers of these vehicles be held accountable. I am attaching a photo from all angles with the date and time of the offense.",0,False
"Good afternoon. At the intersection of 2-Institutsky lane 31 A and Kavkazskaya there is a traffic light, which is completely overgrown in the bushes. Leaving Institutskaya for Kavkazskaya it is impossible to see what kind of light is on",0,False
"Hello, help me remove the scooter from the entrance!!! This scooter is located at the address: Nadezhda Plevitskaya ave. the management company ""Instep"" wrote .... there is no result !!! in the social network ""Vkontakte"" group Overheard Prospekt N. Plevitskaya, post dated April 15 15:46 2021 there was a request to remove the scooter, as it contains fuel and lubricants, and according to fire safety is impossible ... a certain Aleksey Pisarenkov insulted and humiliated other participants in the correspondence ... on 04/29/2021 I went to the Instep Management Company and reported a problem and swearing at this person, they looked at the data, there is no such person in the database !!! at my request call the traffic police, and firefighters, draw up an act, they refused to find the owner of the scooter (most likely he lives on the 2nd floor if he puts the scooter there) The Criminal Code also refused,or didn’t want to look .... oil and gasoline flows from the scooter, there is also a chair there .... although this is all forbidden and is an emergency exit ... .. I ask through the traffic police, the management company, firefighters (so that they still draw up an act on this person) find the owner of this scooter, and remove the scooter from the entrance, fine for repeated requests to remove the scooter. today 04/29/2021",0,False
"I ask you to remove the garbage in the Lgov mik-2 (turn) next to the MAGNIT store and house 105. There is a lot of garbage but no one cleans it up, ask the educational institutions to organize a subbotnik and that they cut all the branches and remove all the garbage.",16,False
"At the crossroads of st. Sumy and Deineki, near the square with the monument to Deineka, on the sidewalk and lawn for more than 2 weeks from parked cars and from tables they sell fruits and vegetables. They occupied half the sidewalk and trampled the lawn opposite. After trading, they leave garbage and their ancillary items of trade. Take action.",13,False
Why is there no stop for public transport near Lenta and Leroy stores,8,False
"Hello. We kindly ask you to remove all garbage, dirt and sand from the place where snow was stored in the winter on Prostornaya Street, also outside the site, where dirty snow was transported all winter, with garbage and waste. At the moment, a dump of branches and trees is already being formed there, cut down from the site (cadastral number 46:29:102208:120) and thrown onto a plot of land where snow was stored in winter. Since this land belongs to the city of Kursk, a big request is to put it in order in the near future.",16,False
"I ask you to install stop pavilions at bus stop PCh No. 30. Your stop is considered legal and you don’t need to write that you don’t have it, and that you don’t have money to install a pavilion, there is also no sign and lighting at the stop, please put everything in order.",8,False
pour concrete on new pavement,0,False
"In the forest area adjacent to the houses at 56.60 along Chernyakhovsky Street, a huge flock of dogs started up. Now puppies have appeared in it and closer to spring the flock becomes aggressive, barking at everyone. Please take action.",11,False
Rubbish in the backyard,16,False
"Near the bus stop ""May Boulevard"" there is a lot of garbage, like bottles, wrappers, bulls, and a folding sofa. This garbage has been lying since spring for sure. Should utilities clean it up?",16,False
Hello. I ask you to clear the road to Sosnovaya Street in the village of Krutoe from snow.,0,False
Good afternoon Please take immediate action on the issue of dogs near Conti Children cross the road to the equestrian school and are attacked by a pack of stray dogs. Employees of Conti and the surrounding bases feed and vaccinate without understanding the danger of a pack with puppies and a leader for children! Please take immediate action!!!!,1,False
"Hello. a nightmare is happening in the park behind Mendeleev's house 24. It is dangerous even for an adult to go there, not to mention children. Broken glass and syringes everywhere. On their own, the people of the nearest houses cannot be removed. Please help me get rid of this horror.",16,False
"When you find the money and install a secure fence in kindergarten No. 3, why strangers constantly run around the kindergarten at night, then adults come to drink beer, but youngsters come to break something. Can't you really take part in some kind of program that would allocate funds for the fence. It is also very dark near the kindergarten, there is no lighting, we lead the children through the darkness, not a single lantern, and there is no need to write about the lighting on / off mode, I know the schedule without you, better explain why there is no lighting, briefly and to be clear.",7,False
