Message text,Категория,Kategory
"Good afternoon! In June 2021, she applied to the social protection committee for the city of Kursk on the issue of receiving targeted assistance (social contract) for current needs in a difficult life situation (school uniform, shoes, stationery, etc. for children). I was given very detailed and good-natured advice by a specialist. We agreed that I would call in July to make an appointment (submission of documents). They promised to add me to the lists and provide assistance by September (shopping for the school). At the beginning of July, I started collecting income certificates (the consultant's request to speed up the process, as I understand it, the specialist requests these certificates on his own) and other documents. The first certificate was ready on 07/06/21. On 08.07 I called to make an appointment. July is no longer available. There was no appointment for August yet, they offered to call next week. Called today, 13.07, but I was denied entry on the basis of an oral order about the lack of funds for these purposes (date, document number, and also until what time, the specialist could not answer). They suggested calling the regional committee. Although initially they took all my data (name, phone number, family composition, etc.), but did not call. They consulted in detail and took my contacts for a possible solution to the issue. I believe my rights have been violated. According to the information from the committee, I can only use assistance for other needs (subsistence farming, opening an individual entrepreneur, training through an employment center), which do not suit me. Or next year (also not suitable, as I plan to go to work and improve my material level). Please look into the situation. Thank you in advance.",10,False
Violation of parking rules. And then we wonder why we have such lawns in the city.,0,False
There are no road markings at the pedestrian crossing,0,False
Stop PATP. The stop complex is not equipped. People stand without the possibility of shelter in adverse weather conditions. Trucks are parked here.,8,False
Huge pits all over this street!!! does not comply with GOST R 50597-93!! The size is more than 15 cm. Emergency condition!!! 12 days to fix!!!,0,False
"I ask you to restore street lighting along Engels Street. There is very little lighting, turn on the lighting at least through the pole. There are also no lights at bus stops.",0,False
"Hello! In GSK on Orlovskaya street, in the area of ​​house No. 1, “kind” people fed a pack of stray dogs. Dogs now consider the territory as their own and show aggression towards people and other dogs passing by (and they regularly go past to other garages and to the forest). I ask you to catch orphan animals before it comes to biting. In the application there is a map with a mark. The main sign is a power line support",1,False
"Good afternoon, along Repina Street in Kursk this year, cutters were dumped in violation of technology (the cutters were scattered and not rolled), even when the cutters were fresh, the car “buried” in it, now heavy equipment drove along this road a couple of times and a rut formed, that it became impossible to drive a passenger car even along the height of the track (the car clings), that year they poured milling cutters on a parallel street and this year on the street along the landings (marked in purple), there is no such problem, everything is done according to technology, the heavy one passes and does not ruins the cover! I ask you to take measures to restore the coating, involve an unscrupulous contractor to correct the road (roll and possibly add milling cutters). Yandex screen: purple color - roads paved according to technology (vehicles pass without scolding the coating) Red color: the road needs to be restored (Repina street)",0,False
"Please, please answer the following questions. When will the `Moscow` trams be on the line? How many tramcars have been repainted according to the design code requirements? Will the tramway be altered, if so, in what areas?",8,False
"Dear Roman Vladimirovich, at the Deriglazov + METRO shopping center, it is possible to go around the solid pits, please eliminate them soon, otherwise most of the cars go around in the oncoming lane of the trolleybus. Thank you!",0,False
"Please patch up the section of the road from the Deriglazov intersection along the Kursk-Iskra highway to the market on Deriglazov which, spill the seams and make a hole, please, how much time has passed and zero sense! Did they promise to do or wait for the promised three years?",0,False
"On January 12, 2022, I filed an appeal to No. KO-01-22-130, which was transferred to the Committee of the City of Kursk, in the response of the committee I was instructed to find two witnesses and provide explanations from them regarding my complaint against the driver of the KIA car state number n143px46, which on January 11, 2022 at 14-30 threw garbage next to the roadway at the address: Kursk, st. Aeroportovskaya houses 66 and 68, but the fact of the offense was recorded by me alone, a photograph was attached. On February 02, 2022, the driver of another state vehicle. number o228x46 at 08-00 threw garbage at the same address (photos and videos are attached). In connection with the illegal actions of these and other drivers at the address: Kursk, st. Airport buildings 66 and 68 have formed an unauthorized dump where wild, stray dogs eat leftovers, they take away garbage and behave aggressively towards citizens passing by, among whom there are many children. I ask you to take any measures to influence the above violators, in order to further exclude their illegal actions of throwing garbage in the wrong places; to oblige city services that clean the road to the airport and adjacent areas to clean this small area up to house No. 68 on Aeroportovskaya Street; to oblige the Veteran, Aviator, Bogatyr, Romashka gardening associations and cottages in the airport area to conclude agreements for the removal of solid household waste; It's just that they throw garbage in the wrong places. to further exclude their illegal actions of throwing garbage in the wrong places; to oblige city services that clean the road to the airport and adjacent areas to clean this small area up to house No. 68 on Aeroportovskaya Street; to oblige the Veteran, Aviator, Bogatyr, Romashka gardening associations and cottages in the airport area to conclude agreements for the removal of solid household waste; It's just that they throw garbage in the wrong places. to further exclude their illegal actions of throwing garbage in the wrong places; to oblige city services that clean the road to the airport and adjacent areas to clean this small area up to house No. 68 on Aeroportovskaya Street; to oblige the Veteran, Aviator, Bogatyr, Romashka gardening associations and cottages in the airport area to conclude agreements for the removal of solid household waste; It's just that they throw garbage in the wrong places.",1,False
"The railing pedestrian fence on the bridge near the intersection of Vatutina and Boytsov streets of the 9th division has significant damage, deformations of struts and beams, ruptures of welds. The fence needs to be repaired.",0,True
"A long wait for a doctor's appointment, a lot of people, the issuance of coupons for an appointment with a doctor is not properly organized. It is necessary to close the sick leave, the doctor who must sign it is not available, when he will be in the registry they cannot answer exactly. Instead, other doctors refuse to sign the sick leave. Zheleznogorsk OBUZ ZhGB.",4,False
"Good afternoon. There is a high curb in front of the pedestrian crossing, which fascinates the entrance to the zebra crossing. Previously, it was possible to go around with a stroller, but now a fence has been put up, and with a stroller you need to go down and return to the zebra through the parking lot.",0,False
"Garbage dump between 1st Ukolovo and 2nd Ukolovo, Zotukhinsky district Coordinates 51.990542, 36.441460",16,False
"I ask you to remove all illegal or legal minibuses in the direction of Kursk-Kurchatov-Kursk. Some suspicious minibuses go in this direction. This photo shows a minibus, it seems to me that it is not legal because I have never seen similar models of cars that transported people. The photo clearly shows the number of the car.",8,False
"Hello! I am writing to you with the problem of public transport, and in particular with the problem of getting to the central part of the city from the Volokno district. Why do I have to spend 30-40 minutes every day to go to work? Why is there a very meager amount of transport going towards SHA, Deriglazov, APZ-20, AIRPORT? It is possible to leave in the morning, but you need to wait for transport for 30-40 minutes, now it is already cold in the morning, and winter is not far off. About the evening time, and especially after 21:00, it is not possible to go towards the Fiber, only by taxi (in order for me to take a taxi every day, I need to earn at least 50,000 rubles a month). Please solve the problem, I understand that everyone does not care about the Fiber for a long time, but we are living people and we cannot wait for transport for half our lives !!!",8,False
"I ask you to install a traffic light along Druzhby Avenue of the city of Kursk, school stop 54, due to the expansion of Druzhby Avenue from the private sector, the flow of cars has increased, they drive in an inexhaustible stream, it is impossible to safely cross the road from the school 54 stop towards house 11.2 Druzhby Ave towards the school 54 cities of Kursk. It is very scary to cross the road, cars go and do not stop. Please install a traffic light at the pedestrian crossing. Thanks.",0,False
"I ask you to install a modern stop pavilion of the `Perekalsky Square` stop. The stop must meet all the requirements, it must be equipped with a ramp and tactile tiles for passengers with limited mobility. The platform must be raised. we do not have low-floor trams, and a high platform will allow you to safely be at a stop waiting for a tram, you also need to make separate",0,False
"Hello! Pay attention to the pedestrian crossing in the city of Kursk on the street. Sumy (opposite house number 25), it is definitely not intended for people with limited mobility, but on the opposite side (near house number 20) it completely rests on the lawn. There is a similar problem at the intersection of Sumskaya and Zavodskaya streets (but at least there are paving slabs).",0,False
"I ask you to install traffic lights at the intersection of Gagarin St. and Nepichiy St. There should be a traffic light on this section of the road, drivers do not see road signs and violate traffic rules. Please, please install traffic lights on this section of the road and install LED lighting on at least 3 reinforced concrete poles.",0,False
"Along the forest belt, I observe an unauthorized garbage dump, which is increasing every year. On the map, I indicated only one point, but in fact the garbage heaps are located along the entire length of the forest belt and in the ravine to which it adjoins. Please take action!",16,False
"Hello! According to the message No. 87061, the rubble filling of the rural road along Evgrafov Bugor Street should be completed by the end of June 2021. The crushed stone filling was not carried out, in two or three places coal slag was added from the school boiler house. With the onset of spring off-road, the road turned into a continuous mess. The car shop cannot go to the street. Another unsubscribe was made. Backfilling must be carried out along the entire length of the road. This year, several trucks with soil were brought in, but it's good that the dumping has not yet been done, otherwise there would be even more dirt. It is not clear why this soil was brought in and lies in heaps, these trucks further aggravated the unsatisfactory condition of the road. Please let me know if the road will be backfilled with rubble. Thank you!",0,False
"Zheleznogoosky district with. Azhovo st. Seletskaya d. 2-4. The problem with the water supply, and the road. Within 6 months, the road and water supply are being repaired, but there is no result. I ask you to evaluate the officials for their incompetence and squandering of budget funds. At present, water from a burst of water supply breaks my site, the road is damaged, i.e. the passage is blocked, there is no other passage.",0,False
"An unknown building is being built near the house at 131 Suvorovskaya Street (the passport of the object, as always, is not available in Kursk), construction equipment has broken the entire new sidewalk. urgently take action as they will break everything and will not restore",11,True
"The vast territory was fenced off, while leaving no passage for pedestrians. The photo shows how the paths rest against the fence. And so, along the entire perimeter, the designed passages are roughly blocked",0,False
"On January 14, I visited our regional hospital. The rheumatologist ordered me to take tests. At the reception, they told me that they only accept a general blood and urine test. They don't do other tests. Explain to me why I should borrow money and take paid tests? I live in Zvanny, Glushkovsky district. I came specially to see a doctor, because we don’t have such a thing. In Glushkovo, too, not all analyzes are done. Regional Hospital!!!! People are being pushed around the floors. To make a copy of the ultrasound, you need to go down 1 floor from 4 floors, pay 3 rubles per sheet and go up again to 4 floors. Even if there are 2 elevators, this is inconvenient for the healthy, not to mention the sick. Why shoe covers for a fee? I wrote a complaint through VK under the nickname Lena Levin. They did not even contact me, although I left the data.",4,False
Please remove the dead dog. Short of the center of the kia between the footpath and the road on the lawn,0,False
"I applied for a certificate of having been ill through public services. it is written that the deadline for consideration is the 27th, should I even wait for it? I urgently need a QR code, please tell me when I can get it?",4,False
"I ask you please install lighting on the street. Parkovaya starting from the railway crossing and ending with the railway hospital. At least install lighting on this small section, yesterday there was a bit of an accident, the fact is that this section of the road is very narrow and there is not much lighting, there are no sidewalks, and yesterday a child ran straight into the roadway because of a dark intersection. I ask you to hang directly on the already installed brackets. Please please install as soon as possible",0,False
Lack of hard pavement on city streets,0,False
"Dear Roman Vladimirovich, I ask you to arrange and allocate funds for the construction of a sidewalk along 40 Let Oktyabrya Street in the city of Lgov and for the installation of lighting, as well as for the installation of a bus stop pavilion (Liteynaya Street).",0,False
"Local housing and communal services are constantly digging up the intersection. Not only is there no asphalt pavement, but also permanent catacombs",0,False
Why don't you work out the issue of improving parking spaces for administration employees and for citizens? Why can't you make a parking zone in this place? In this place it is necessary to establish a parking and parking sign. This parking zone will unload Red Square from cars.,0,False
"On 05/07/2021, the following facts of the placement of vehicles in areas without artificial turf were revealed: 1) MAZDA СХ-5 with the state registration plate О673ОО46 at 16:07 in the area of ​​house No. 32 on Orlovskaya Street; 2) OPEL ASTRA with the state registration plate U049NS197 at 16:09 in the area of ​​house No. 30 on Orlovskaya Street. I ask you to bring the drivers of these vehicles to administrative responsibility, provided for in Article 28 of Law No. 1-ZKO `On Administrative Offenses in the Kursk Region`",0,False
"On three streets of the village, namely: Lenin, Kirova and Oktyabrskaya, there is a terrible road surface with many holes, the village administration does not react to this situation in any way, please look into this. Also, at the railway crossing in the area of ​​Privokzalnaya Street, when pits appeared on the road, they were simply covered with sand, and not patched up.",0,False
"Good evening. 1. I do not agree with the Decision and did not close the complaint. 2. Please send the response of the Administration to E-mail with the signature and seal of the person in charge who prepared the answer, for further sending the complaint to a higher authority. 3. If the Administration believes that this is a hard gravel coating in the village, I ask the specialists to go to the place and blindly show me that hard coating after the rains. E -mail innatumanova@mail.ru ​​​​​. Please provide a response within the time limits provided for by applicable law.",0,False
How much can you write about the problem of roads and lighting. My appeals receive only regular replies. There is no road along Sovetskaya street. There is no lighting. Eight lights are off. The local government is inactive. Take action.,0,False
"Good afternoon! Residents of the village of N. Gridino, Bolshesoldatsky district, are contacting you regarding the lack of buses in our district. Our problem is that for the past two months we have not been able to get to the district center (the village of Bolshaya Soldatskoye). One gets the impression that our administration is completely indifferent to how the elderly residents of the district get to the hospital, market, shops and pharmacies (they are not available in some villages). Please pay attention to our problem and help in solving it.",8,False
"Hello! Behind the apartment building No. 88 (Engels Street), the road surface is in a terrible state. Maybe the county or the road service will be able to repair the damaged asphalt pavement or put this section on the list of roads that need urgent repairs? Thanks in advance!",0,False
"Good afternoon. She submitted documents for participation in the competition for inclusion in the reserve for a senior position in the civil service. They called me and invited me for testing, they told me by phone to arrive on March 18 at 12:00 at the address: Internationalnaya, 6 to take the test. More detailed information was not available. The address was incorrect, as it turned out. Arriving at the Civil Service Academy, I was offered to take a test on a computer, consisting of 100 questions for a while, I was not familiar with the test in advance, even with the topic. As a result, I got 59 out of 100 points, answering questions that I have not encountered in any way in my life. As a result, I did not pass the second stage. I think that conducting such tests is the goal of conducting a selection “for show”, so that the vacant places are occupied by the “necessary” people. Corruption cannot be defeated in this way. If I knew the topic of the test and prepared, then I would get the right amount of points. My education, work experience and high personal responsibility could be useful to our region. Please do not disregard this letter.",14,False
"It is impossible to leave by tram, following at 22:25 on route 4, in the direction of the final stop `ul. Malysheva`, because the wagon goes to the square. Dobrolyubova. This is extremely inconvenient and inefficient, because people are waiting for transport, but they cannot leave. Please reconsider the timetable and follow the last tram to the final stop of the route, without abbreviations.",8,False
"The pedestrian zone next to the 15 microdistrict bus stop is not equipped for wheelchairs, you have to lift the stroller with the child through a high curb. Please consider my complaint",0,False
"I ask you to install lighting on the street. Factory. Install the lighting at least through the support and be sure to hang the lighting on the bracket itself, which already costs God knows how much it costs, but not at the bottom of the bracket. We hope that we will have lighting.",0,False
"I ask the City Administration as well as the Committee of Transport and Roads of the Kursk Region to consider and approve the plan for the movement of urban transport along Sovetskaya Street. I would like a public transport stop to be installed next to the MFC, there is just a territory that allows it. Many people go to the MFC, mostly the elderly, and it will be problematic for the elderly to walk from the CRH stop or from the Gagarina street stop. It's winter now, most sidewalks are not sprinkled and there is ice, and how will a grandmother or grandfather of advanced age go into ice? Please give this problem some time. I will create an idea on this site for people to vote.",8,False
"Hello. After a blizzard and snowfall on January 13, 2021, roads and entrances to Sosnovaya Street are not cleaned.",0,False
"Good afternoon. At the address st. Engels, 169 is a pedestrian crossing. Drivers rush about without noticing the signs, there are no markings.",0,False
"Good afternoon. In June and July, she left prescriptions for Symbicort at pharmacy N 100 in Zheleznogorsk, Kursk Region, because the required medicine was not available. On the 17th I came to the pharmacy with a new prescription written out in September. The drug appeared in the pharmacy, but they gave it to me only according to the September prescription, the prescriptions for June and July were said not to be skipped by the program, because they are no longer valid. It turns out a vicious circle of some kind, and as a result, 2 prescriptions simply disappeared and I was left without medicine.",4,False
"I ask you to catch stray dogs near my house, located at Kursk district, Mayskaya Zarya, 35-b. dogs show aggression, bark and rush at people.",1,False
dangerous manhole,0,False
"Hello. Without waiting for an answer, once again I want to introduce an adjustment to the problem. Asphalt road, 3000 m in the area where repairs are being carried out, why is the new asphalt road not brought to the new road in the Solntsevsky district? After all, there is actually a remainder of 2-3 km ... There is no lighting on the entire section of the road in the village of Polevaya!!! In addition to the Lyceum, there are 2 lanterns and partially at the entrance to the village. For the rest, there is NOT A SINGLE FANAR leaving the school in the direction of Gutorovo!!! I'm not talking about lighting in Upper Gutorovo = there is none at all! How can people live? What security are we talking about? She just doesn't exist. The only lantern near the school… Well, back to the road in Verkhniy Gutorovo… we received an answer that pavement work is planned in 22-23, but there are sections that simply cannot be driven through…. Is it possible for you to help in the organization of at least some kind of embankment so that the cars do not settle in a pile of dirt and puddles? After all, the garbage is not taken out there, not a single tank. Garbage cars don't go there. Rubbish is everywhere. Asphalt. Lighting. Trash",0,False
"When will all advertising banners be removed from the bus station building? How long will it be fun there? Is it really impossible to bring the bus station into a human form, it is necessary to remove both “happy journey” and “buy tickets online” - this spoils the general impression of our region. Nadruo to make repairs in the building itself, first of all, it is necessary to solve the issue with the ceiling, at the moment it is dirty and scary, and there is not enough lighting for such a room.",8,False
It is impossible to sign up for vaccination at public services,4,False
"After a frosty and snowy winter, on the roads of Anatoly Deriglazov Avenue - from the intersection to the KPP trolleybus stops, potholes, bumps, pits were formed, which are filled with water (a huge puddle when moving from Deriglazov towards the center) near the fire station). Cars are maneuvering, driving into the oncoming lane i.e. it is not possible to drive around this section of the road unscathed, creating emergency situations. Stopping at each pit increases the travel time for this section of the road and increases the already huge traffic jam that occurs every day when leaving the village. I ask you to carry out patching as soon as possible in order to avoid an accident on this section of the road.",0,False
"Hello, corruption is rampant in Lgov in all areas. Here, for example, for about 10 years, a corruption scheme in budget money has been flourishing in the Sports and Health Complex. 1. A lot of sections are open in FOK, in different directions, for example, how coaches who receive money from the budget of the city of Lgov collect a certain fee from their students. Then they cut these funds with the director of the FOK. Some contracts, checks and supporting documents are not given. We think now it is clear to you why this is so? 2. And also a lot of dead souls are decorated in FOK, again. Funds for dead souls are received by the director of the FOC. Mikhail Vyacheslavovich Tivelev and curator Vyacheslav Petrovich Kutsev in all financial matters, under the auspices of M.V. Tivelev. Please check all areas. perhaps the local prosecutor's office also covers these persons in this matter. Understand, please.",15,False
